{
  "schema": "image2figma.v1",
  "meta": {
    "name": "Appointment Waitlist Dashboard",
    "generator": "codex-image2figma",
    "sourceImage": "appointment-waitlist.webp"
  },
  "page": {
    "name": "Appointment Waitlist Dashboard",
    "background": {
      "r": 0.82,
      "g": 0.82,
      "b": 0.79,
      "a": 1
    }
  },
  "root": {
    "type": "FRAME",
    "name": "Appointment Waitlist Dashboard",
    "size": {
      "width": 1920,
      "height": 1280
    },
    "fills": [
      {
        "type": "SOLID",
        "color": {
          "r": 0.82,
          "g": 0.82,
          "b": 0.79
        },
        "opacity": 1
      }
    ],
    "children": [
      {
        "type": "IMAGE",
        "name": "Source Image Reference",
        "position": {
          "x": 1396,
          "y": 36
        },
        "size": {
          "width": 360,
          "height": 240
        },
        "assetRef": "appointment-waitlist.webp",
        "placeholder": "Original reference image for comparison"
      },
      {
        "type": "FRAME",
        "name": "App Window",
        "position": {
          "x": 54,
          "y": 107
        },
        "size": {
          "width": 1814,
          "height": 1170
        },
        "fills": [
          {
            "type": "SOLID",
            "color": {
              "r": 0.97,
              "g": 0.97,
              "b": 0.96
            },
            "opacity": 1
          }
        ],
        "cornerRadius": 28,
        "effects": [
          {
            "type": "DROP_SHADOW",
            "offset": {
              "x": 0,
              "y": 26
            },
            "radius": 40,
            "color": {
              "r": 0,
              "g": 0,
              "b": 0,
              "a": 0.16
            }
          }
        ],
        "children": [
          {
            "type": "FRAME",
            "name": "Sidebar",
            "position": {
              "x": 12,
              "y": 10
            },
            "size": {
              "width": 292,
              "height": 1150
            },
            "fills": [
              {
                "type": "SOLID",
                "color": {
                  "r": 0.93,
                  "g": 0.93,
                  "b": 0.91
                },
                "opacity": 1
              }
            ],
            "cornerRadius": 20,
            "children": [
              {
                "type": "IMAGE",
                "name": "Sidebar Icons",
                "position": {
                  "x": 18,
                  "y": 18
                },
                "size": {
                  "width": 266,
                  "height": 820
                },
                "placeholder": "All small sidebar icons including brand, notifications, search, navigation, and company icons"
              },
              {
                "type": "TEXT",
                "name": "Location",
                "position": {
                  "x": 52,
                  "y": 18
                },
                "size": {
                  "width": 170,
                  "height": 24
                },
                "text": {
                  "characters": "PWT Location",
                  "style": {
                    "fontFamily": "Inter",
                    "fontWeight": 600,
                    "fontSize": 17,
                    "lineHeightPx": 24,
                    "textAlignHorizontal": "LEFT"
                  }
                },
                "fills": [
                  {
                    "type": "SOLID",
                    "color": {
                      "r": 0.06,
                      "g": 0.07,
                      "b": 0.07
                    },
                    "opacity": 1
                  }
                ]
              },
              {
                "type": "FRAME",
                "name": "Search Field",
                "position": {
                  "x": 10,
                  "y": 82
                },
                "size": {
                  "width": 272,
                  "height": 42
                },
                "fills": [
                  {
                    "type": "SOLID",
                    "color": {
                      "r": 0.87,
                      "g": 0.87,
                      "b": 0.85
                    },
                    "opacity": 1
                  }
                ],
                "cornerRadius": 9,
                "children": [
                  {
                    "type": "TEXT",
                    "name": "Search Text",
                    "position": {
                      "x": 48,
                      "y": 10
                    },
                    "size": {
                      "width": 190,
                      "height": 22
                    },
                    "text": {
                      "characters": "Search                       Cmd S",
                      "style": {
                        "fontFamily": "Inter",
                        "fontWeight": 400,
                        "fontSize": 16,
                        "lineHeightPx": 22,
                        "textAlignHorizontal": "LEFT"
                      }
                    },
                    "fills": [
                      {
                        "type": "SOLID",
                        "color": {
                          "r": 0.29,
                          "g": 0.3,
                          "b": 0.29
                        },
                        "opacity": 1
                      }
                    ]
                  }
                ]
              },
              {
                "type": "TEXT",
                "name": "Sidebar Menu",
                "position": {
                  "x": 54,
                  "y": 150
                },
                "size": {
                  "width": 190,
                  "height": 690
                },
                "text": {
                  "characters": "Home\n\nWORKSPACE\nAppointment\nSales\nCustomers\nReport\n\nCATALOG\nServices\nProducts\nPackages\n\nCOMPANY\nStaff\nMarketing\nWebsite\nIntegration",
                  "style": {
                    "fontFamily": "Inter",
                    "fontWeight": 400,
                    "fontSize": 17,
                    "lineHeightPx": 37,
                    "textAlignHorizontal": "LEFT"
                  }
                },
                "fills": [
                  {
                    "type": "SOLID",
                    "color": {
                      "r": 0.28,
                      "g": 0.29,
                      "b": 0.28
                    },
                    "opacity": 1
                  }
                ]
              },
              {
                "type": "RECTANGLE",
                "name": "Active Appointment Highlight",
                "position": {
                  "x": 10,
                  "y": 230
                },
                "size": {
                  "width": 272,
                  "height": 44
                },
                "fills": [
                  {
                    "type": "SOLID",
                    "color": {
                      "r": 1,
                      "g": 1,
                      "b": 1
                    },
                    "opacity": 1
                  }
                ],
                "cornerRadius": 8
              },
              {
                "type": "FRAME",
                "name": "Sidebar Footer",
                "position": {
                  "x": 10,
                  "y": 1112
                },
                "size": {
                  "width": 272,
                  "height": 36
                },
                "fills": [
                  {
                    "type": "SOLID",
                    "color": {
                      "r": 0.93,
                      "g": 0.93,
                      "b": 0.91
                    },
                    "opacity": 1
                  }
                ],
                "children": [
                  {
                    "type": "RECTANGLE",
                    "name": "Invite Button",
                    "position": {
                      "x": 0,
                      "y": 0
                    },
                    "size": {
                      "width": 138,
                      "height": 36
                    },
                    "fills": [
                      {
                        "type": "SOLID",
                        "color": {
                          "r": 1,
                          "g": 1,
                          "b": 1
                        },
                        "opacity": 1
                      }
                    ],
                    "cornerRadius": 10
                  },
                  {
                    "type": "RECTANGLE",
                    "name": "Tutorials Button",
                    "position": {
                      "x": 148,
                      "y": 0
                    },
                    "size": {
                      "width": 124,
                      "height": 36
                    },
                    "fills": [
                      {
                        "type": "SOLID",
                        "color": {
                          "r": 1,
                          "g": 1,
                          "b": 1
                        },
                        "opacity": 1
                      }
                    ],
                    "cornerRadius": 10
                  },
                  {
                    "type": "TEXT",
                    "name": "Footer Labels",
                    "position": {
                      "x": 58,
                      "y": 8
                    },
                    "size": {
                      "width": 206,
                      "height": 20
                    },
                    "text": {